[{
  "location": {
    "name": "Test District, Test Subdistrict, Reading",
    "administrativeArea": "Reading",
    "subDistrict": "Test Subdistrict",
    "nameQualifier": "generated by concatenating registrationDistrict, subDistrict and administrativeArea",
    "registrationDistrict": "Test District"
  },
  "subjects": {
    "child": {
      "originalName": {

      },
      "name": {
        "givenName": "Tester",
        "surname": "Solo",
        "fullName": "Tester Solo",
        "qualifier": "generated from prepending forename to surname"
      },
      "dateOfBirth": "2012-02-29",
      "sex": "Male",
      "birthplace": "Test Address"
    },
    "father": {
      "name": {
        "givenName": "Dad",
        "surname": "Solo",
        "fullName": "Dad Solo",
        "qualifier": "generated from prepending forename to surname"
      },
      "birthplace": "Test Birthplace"
    },
    "mother": {
      "name": {
        "givenName": "Mum",
        "surname": "Solo",
        "fullName": "Mum Solo",
        "qualifier": "generated from prepending forename to surname"
      },
      "birthplace": "Test Birthplace",
      "maidenSurname": "prev-Solo",
      "marriageSurname": "prev-M-Solo"
    },
    "informant": {
      "name": {

      },
      "qualification": "Mother",
      "signature": "Mary Manzarek"
    }
  },
  "systemNumber": 999999910,
  "id": 999999910,
  "date": "2014-10-10",
  "status": {
    "potentiallyFictitiousBirth": false,
    "correction": "None",
    "cancelled": false,
    "blockedRegistration": false,
    "marginalNote": "None",
    "reRegistered": "None"
  },
  "previousRegistration": {

  }
}]